edit_history_tweet_ids,lang,possibly_sensitive,text,created_at,reply_settings,author_id,conversation_id,id,category,edit_controls.edits_remaining,edit_controls.is_edit_eligible,edit_controls.editable_until,entities.urls,public_metrics.retweet_count,public_metrics.reply_count,public_metrics.like_count,public_metrics.quote_count,public_metrics.bookmark_count,public_metrics.impression_count,attachments.media_keys,context_annotations,referenced_tweets,in_reply_to_user_id,entities.annotations,entities.mentions,entities.hashtags,attachments.media_source_tweet_id,attachments.poll_ids
['1874086747178414133'],pl,False,"Rok 2024 kończę w znacznie lepszym nastroju niż poprzedni. Byłem wtedy świeżo po przegranych wyborach, sondaże nam szorowały po dnie, mieliśmy przed sobą bardzo trudne dla Konfederacji wybory samorządowe i wywołujący sporo napięć wewnętrznych proces wyboru kandydata na… https://t.co/QXY94tKfhz",2024-12-31T13:34:34.000Z,everyone,3242182113,1874086747178414133,1874086747178414133,Original,5,True,2024-12-31 14:34:34+00:00,"[{'start': 271, 'end': 294, 'url': 'https://t.co/QXY94tKfhz', 'expanded_url': 'https://x.com/i/web/status/1874086747178414133', 'display_url': 'x.com/i/web/status/1…'}]",113,203,2878,8,37,127191,,,,,,,,,
['1873400302390661256'],pl,False,"Już myślałem, że nie zdążę przed zmrokiem, ale dotarłem do schroniska niemal równo z zachodem słońca. Jutro przez Halę Miziową na Pilsko. https://t.co/gn9gXlSoeA",2024-12-29T16:06:52.000Z,everyone,3242182113,1873400302390661256,1873400302390661256,Original,5,True,2024-12-29 17:06:52+00:00,"[{'start': 138, 'end': 161, 'url': 'https://t.co/gn9gXlSoeA', 'expanded_url': 'https://x.com/SlawomirMentzen/status/1873400302390661256/photo/1', 'display_url': 'pic.x.com/gn9gXlSoeA', 'media_key': '3_1873399886533545984'}, {'start': 138, 'end': 161, 'url': 'https://t.co/gn9gXlSoeA', 'expanded_url': 'https://x.com/SlawomirMentzen/status/1873400302390661256/photo/1', 'display_url': 'pic.x.com/gn9gXlSoeA', 'media_key': '3_1873400271121883136'}, {'start': 138, 'end': 161, 'url': 'https://t.co/gn9gXlSoeA', 'expanded_url': 'https://x.com/SlawomirMentzen/status/1873400302390661256/photo/1', 'display_url': 'pic.x.com/gn9gXlSoeA', 'media_key': '3_1873399886600617984'}, {'start': 138, 'end': 161, 'url': 'https://t.co/gn9gXlSoeA', 'expanded_url': 'https://x.com/SlawomirMentzen/status/1873400302390661256/photo/1', 'display_url': 'pic.x.com/gn9gXlSoeA', 'media_key': '3_1873399886516797440'}]",83,327,4246,12,50,187750,"['3_1873399886533545984', '3_1873400271121883136', '3_1873399886600617984', '3_1873399886516797440']",,,,,,,,
['1872242350183116873'],pl,False,"Nie idzie ostatnio źle ten YouTube :)

Prawie 25 mln wyświetleń w 28 dni :) https://t.co/BrMxQ9W1lh",2024-12-26T11:25:35.000Z,everyone,3242182113,1872242350183116873,1872242350183116873,Original,5,True,2024-12-26 12:25:35+00:00,"[{'start': 76, 'end': 99, 'url': 'https://t.co/BrMxQ9W1lh', 'expanded_url': 'https://x.com/SlawomirMentzen/status/1872242350183116873/photo/1', 'display_url': 'pic.x.com/BrMxQ9W1lh', 'media_key': '3_1872242343618678784'}]",117,248,6058,4,55,288929,['3_1872242343618678784'],"[{'domain': {'id': '131', 'name': 'Unified Twitter Taxonomy', 'description': 'A taxonomy of user interests. '}, 'entity': {'id': '1196446161223028736', 'name': 'Social media'}}, {'domain': {'id': '165', 'name': 'Technology', 'description': 'for individual and types of technology, e.g., food technology, 3D printing'}, 'entity': {'id': '1196446161223028736', 'name': 'Social media'}}, {'domain': {'id': '30', 'name': 'Entities [Entity Service]', 'description': 'Entity Service top level domain, every item that is in Entity Service should be in this domain'}, 'entity': {'id': '781974596752842752', 'name': 'Services'}}, {'domain': {'id': '47', 'name': 'Brand', 'description': 'Brands and Companies'}, 'entity': {'id': '10029382357', 'name': 'YouTube'}}, {'domain': {'id': '131', 'name': 'Unified Twitter Taxonomy', 'description': 'A taxonomy of user interests. '}, 'entity': {'id': '10029382357', 'name': 'YouTube'}}]",,,,,,,
['1871632084831547900'],pl,False,"Jeśli zjem coś więcej, przestanę mieścić się w kadrze :)

Wesołych Świąt Bożego Narodzenia życzy rodzina Mentzenów :) https://t.co/wKvSDV0u8Z",2024-12-24T19:00:36.000Z,everyone,3242182113,1871632084831547900,1871632084831547900,Original,5,True,2024-12-24 20:00:36+00:00,"[{'start': 118, 'end': 141, 'url': 'https://t.co/wKvSDV0u8Z', 'expanded_url': 'https://x.com/SlawomirMentzen/status/1871632084831547900/photo/1', 'display_url': 'pic.x.com/wKvSDV0u8Z', 'media_key': '3_1871632074865610752'}]",219,469,14997,16,191,495296,['3_1871632074865610752'],,,,,,,,
['1871524054915764451'],pl,False,"Życzę wszystkim zdrowych, spokojnych, radosnych, rodzinnych i błogosławionych Świąt Bożego Narodzenia! https://t.co/6xx8bEX2G6",2024-12-24T11:51:20.000Z,everyone,3242182113,1871524054915764451,1871524054915764451,Original,5,True,2024-12-24 12:51:20+00:00,"[{'start': 103, 'end': 126, 'url': 'https://t.co/6xx8bEX2G6', 'expanded_url': 'https://x.com/SlawomirMentzen/status/1871524054915764451/video/1', 'display_url': 'pic.x.com/6xx8bEX2G6', 'media_key': '13_1871523977551577088'}]",130,121,3616,3,33,67764,['13_1871523977551577088'],,,,,,,,
['1871102493205148121'],pl,False,Dzień z Mentzenem ma już milion wyświetleń! Jeśli ktoś jeszcze nie widział - polecam! https://t.co/Mz5o9b1bdN,2024-12-23T07:56:12.000Z,everyone,3242182113,1871102493205148121,1871102493205148121,Original,5,True,2024-12-23 08:56:12+00:00,"[{'start': 86, 'end': 109, 'url': 'https://t.co/Mz5o9b1bdN', 'expanded_url': 'https://x.com/SlawomirMentzen/status/1871102493205148121/photo/1', 'display_url': 'pic.x.com/Mz5o9b1bdN', 'media_key': '3_1871102326045331457'}]",118,170,4643,1,25,142579,['3_1871102326045331457'],,,,,,,,
['1870511619064926698'],en,False,Link: https://t.co/4bezR2AVqe,2024-12-21T16:48:17.000Z,everyone,3242182113,1870511567063953745,1870511619064926698,Reply,5,False,2024-12-21 17:48:17+00:00,"[{'start': 6, 'end': 29, 'url': 'https://t.co/4bezR2AVqe', 'expanded_url': 'https://wspieram.mentzen2025.pl', 'display_url': 'wspieram.mentzen2025.pl', 'status': 200, 'title': 'Wspieram - Mentzen 2025', 'unwound_url': 'https://wspieram.mentzen2025.pl'}]",10,20,230,0,3,27474,,,"[{'type': 'replied_to', 'id': '1870511567063953745'}]",3242182113,,,,,
['1870511567063953745'],pl,False,"Sondaże dają mi silną trzecią pozycję, ale nie startuję w tych wyborach po to, żeby zrobić w nich dobry wynik, tylko żeby je wygrać. Muszę wygrać te wybory, żebyśmy mogli żyć wreszcie w silnej, dumnej, bogatej i bezpiecznej Polsce!

Ogłaszałem już trasę na styczeń, ale… https://t.co/bqB6CJGe1C https://t.co/QdqK4W6Irj",2024-12-21T16:48:04.000Z,everyone,3242182113,1870511567063953745,1870511567063953745,Original,5,False,2024-12-21 17:48:04+00:00,"[{'start': 271, 'end': 294, 'url': 'https://t.co/bqB6CJGe1C', 'expanded_url': 'https://x.com/i/web/status/1870511567063953745', 'display_url': 'x.com/i/web/status/1…'}, {'start': 295, 'end': 318, 'url': 'https://t.co/QdqK4W6Irj', 'expanded_url': 'https://x.com/SlawomirMentzen/status/1870511567063953745/photo/1', 'display_url': 'pic.x.com/QdqK4W6Irj', 'media_key': '3_1870511358921322496'}]",245,428,4033,18,43,278314,['3_1870511358921322496'],,,,,,,,
['1870454613536907587'],pl,False,NIE dla muzułmańskiej imigracji w Polsce! https://t.co/FsD36EqOqd,2024-12-21T13:01:45.000Z,everyone,3242182113,1870454613536907587,1870454613536907587,Original,5,True,2024-12-21 14:01:45+00:00,"[{'start': 42, 'end': 65, 'url': 'https://t.co/FsD36EqOqd', 'expanded_url': 'https://x.com/SlawomirMentzen/status/1870454613536907587/photo/1', 'display_url': 'pic.x.com/FsD36EqOqd', 'media_key': '3_1870454607941668864'}]",701,575,11690,30,89,266399,['3_1870454607941668864'],,,,,,,,
['1870422564293517352'],pl,False,"Nagrałem ten materiał w środę, na dwa dni przed tragedią na jarmarku w Magdeburgu. Dzisiaj jest niestety jeszcze bardziej aktualny. 

Nie możemy zgodzić się na migracje z państw muzułmańskich, nie możemy dopuścić do tego, żeby w Polsce było tak niebezpiecznie jak w Niemczech! https://t.co/OWYSXUk0fd",2024-12-21T10:54:24.000Z,everyone,3242182113,1870422564293517352,1870422564293517352,Original,5,True,2024-12-21 11:54:24+00:00,"[{'start': 277, 'end': 300, 'url': 'https://t.co/OWYSXUk0fd', 'expanded_url': 'https://x.com/SlawomirMentzen/status/1870422564293517352/video/1', 'display_url': 'pic.x.com/OWYSXUk0fd', 'media_key': '13_1870422342528061440'}]",479,283,7149,17,217,374612,['13_1870422342528061440'],,,,,,,,
['1870224417877569984'],en,False,"Mass migrations from Asia and Africa are leading to a drastic increase in crime and tragedies, like the one today in Magdeburg.

We want to feel safe in Poland; we don't want to live in fear that someone might murder us at a Christmas market.**

No migration from Muslim… https://t.co/dTxKeF38Zr",2024-12-20T21:47:02.000Z,everyone,3242182113,1870224417877569984,1870224417877569984,Original,5,True,2024-12-20 22:47:02+00:00,"[{'start': 272, 'end': 295, 'url': 'https://t.co/dTxKeF38Zr', 'expanded_url': 'https://x.com/i/web/status/1870224417877569984', 'display_url': 'x.com/i/web/status/1…'}]",580,286,9324,18,89,281842,,"[{'domain': {'id': '29', 'name': 'Events [Entity Service]', 'description': 'Real world events. '}, 'entity': {'id': '1250078501849280512', 'name': 'Christmas', 'description': 'This entity includes all conversations for Christmas for all years.'}}, {'domain': {'id': '29', 'name': 'Events [Entity Service]', 'description': 'Real world events. '}, 'entity': {'id': '1853510897634873344', 'name': 'Christmas 2024'}}, {'domain': {'id': '119', 'name': 'Holiday', 'description': 'Holidays like Christmas or Halloween'}, 'entity': {'id': '1250078501849280512', 'name': 'Christmas', 'description': 'This entity includes all conversations for Christmas for all years.'}}, {'domain': {'id': '119', 'name': 'Holiday', 'description': 'Holidays like Christmas or Halloween'}, 'entity': {'id': '1853510897634873344', 'name': 'Christmas 2024'}}, {'domain': {'id': '131', 'name': 'Unified Twitter Taxonomy', 'description': 'A taxonomy of user interests. '}, 'entity': {'id': '847548225712119808', 'name': 'Holidays', 'description': 'Holidays'}}, {'domain': {'id': '131', 'name': 'Unified Twitter Taxonomy', 'description': 'A taxonomy of user interests. '}, 'entity': {'id': '1250078501849280512', 'name': 'Christmas', 'description': 'This entity includes all conversations for Christmas for all years.'}}, {'domain': {'id': '131', 'name': 'Unified Twitter Taxonomy', 'description': 'A taxonomy of user interests. '}, 'entity': {'id': '1291095284756357120', 'name': 'Cultural events'}}, {'domain': {'id': '131', 'name': 'Unified Twitter Taxonomy', 'description': 'A taxonomy of user interests. '}, 'entity': {'id': '1436053202835689485', 'name': 'Events'}}, {'domain': {'id': '131', 'name': 'Unified Twitter Taxonomy', 'description': 'A taxonomy of user interests. '}, 'entity': {'id': '1853510897634873344', 'name': 'Christmas 2024'}}]",,,"[{'start': 21, 'end': 24, 'probability': 0.9272, 'type': 'Place', 'normalized_text': 'Asia'}, {'start': 30, 'end': 35, 'probability': 0.9743, 'type': 'Place', 'normalized_text': 'Africa'}, {'start': 117, 'end': 125, 'probability': 0.9711, 'type': 'Place', 'normalized_text': 'Magdeburg'}, {'start': 153, 'end': 158, 'probability': 0.9567, 'type': 'Place', 'normalized_text': 'Poland'}]",,,,
['1870190932013752479'],pl,False,"Masowe migracje z Azji i Afryki prowadzą do drastycznego wzrostu przestępczości i tragedii takich jak dzisiaj w Magdeburgu.

Chcemy w Polsce czuć się bezpiecznie, nie chcemy bać się, że ktoś nas zamorduje na bożonarodzeniowym jarmarku. 

Żadnych migracji z państw muzułmańskich!",2024-12-20T19:33:59.000Z,everyone,3242182113,1870190932013752479,1870190932013752479,Original,5,True,2024-12-20 20:33:59+00:00,,786,537,12632,35,105,360461,,,,,,,,,
['1870065252815065416'],pl,False,"Wczoraj spotkałem się z Panem Prezydentem Andrzejem Dudą. Spotkanie przebiegło w życzliwej atmosferze, miało bardzo konstruktywny charakter. Przez większość czasu rozmawialiśmy o najważniejszych dla Polski sprawach.

Pierwsza kwestia to obecny kryzys konstytucyjny. Rząd wybiórczo… https://t.co/tRQu7Yrljn https://t.co/OrYX39Jlvl",2024-12-20T11:14:35.000Z,everyone,3242182113,1870065252815065416,1870065252815065416,Original,5,True,2024-12-20 12:14:35+00:00,"[{'start': 282, 'end': 305, 'url': 'https://t.co/tRQu7Yrljn', 'expanded_url': 'https://x.com/i/web/status/1870065252815065416', 'display_url': 'x.com/i/web/status/1…'}, {'start': 306, 'end': 329, 'url': 'https://t.co/OrYX39Jlvl', 'expanded_url': 'https://x.com/SlawomirMentzen/status/1870065252815065416/photo/1', 'display_url': 'pic.x.com/OrYX39Jlvl', 'media_key': '3_1870065220678209536'}]",304,444,6843,21,118,244854,['3_1870065220678209536'],,,,,,,,
['1869750279165595730'],pl,False,Dziękuję Prezydentowi @AndrzejDuda za konstruktywne spotkanie. Zapowiada się ciekawa kampania! https://t.co/6pYjd9k2yt,2024-12-19T14:22:59.000Z,everyone,3242182113,1869750279165595730,1869750279165595730,Original,5,True,2024-12-19 15:22:59+00:00,"[{'start': 95, 'end': 118, 'url': 'https://t.co/6pYjd9k2yt', 'expanded_url': 'https://x.com/SlawomirMentzen/status/1869750279165595730/photo/1', 'display_url': 'pic.x.com/6pYjd9k2yt', 'media_key': '3_1869750274035736577'}]",286,399,8855,49,122,575431,['3_1869750274035736577'],"[{'domain': {'id': '10', 'name': 'Person', 'description': 'Named people in the world like Nelson Mandela'}, 'entity': {'id': '907614362478690309', 'name': 'Andrzej Duda', 'description': 'President of Poland Andrzej Duda'}}, {'domain': {'id': '35', 'name': 'Politician', 'description': 'Politicians in the world, like Joe Biden'}, 'entity': {'id': '907614362478690309', 'name': 'Andrzej Duda', 'description': 'President of Poland Andrzej Duda'}}, {'domain': {'id': '131', 'name': 'Unified Twitter Taxonomy', 'description': 'A taxonomy of user interests. '}, 'entity': {'id': '847878884917886977', 'name': 'Politics', 'description': 'Politics'}}, {'domain': {'id': '131', 'name': 'Unified Twitter Taxonomy', 'description': 'A taxonomy of user interests. '}, 'entity': {'id': '907614362478690309', 'name': 'Andrzej Duda', 'description': 'President of Poland Andrzej Duda'}}, {'domain': {'id': '131', 'name': 'Unified Twitter Taxonomy', 'description': 'A taxonomy of user interests. '}, 'entity': {'id': '1070032753834438656', 'name': 'Political figures', 'description': 'Politician'}}]",,,,"[{'start': 22, 'end': 34, 'username': 'AndrzejDuda', 'id': '202086424'}]",,,
['1869725535871598659'],pl,False,"O 14:00 spotykam się z Panem Prezydentem Andrzejem Dudą.

Mam nadzieję na ciekawą i konstruktywną rozmowę o trzech bardzo ważnych dla Polaków sprawach.",2024-12-19T12:44:40.000Z,everyone,3242182113,1869725535871598659,1869725535871598659,Original,5,True,2024-12-19 13:44:40+00:00,,104,207,4449,5,69,252724,,,,,,,,,
['1869376149459230829'],pl,False,Pierwszy nieudany zamach na mnie odhaczony :) https://t.co/PBAzjgZUFm,2024-12-18T13:36:20.000Z,everyone,3242182113,1869376149459230829,1869376149459230829,Original,5,True,2024-12-18 14:36:20+00:00,"[{'start': 46, 'end': 69, 'url': 'https://t.co/PBAzjgZUFm', 'expanded_url': 'https://x.com/SlawomirMentzen/status/1869376149459230829/video/1', 'display_url': 'pic.x.com/PBAzjgZUFm', 'media_key': '13_1869376080169025536'}]",218,534,9845,43,340,353340,['13_1869376080169025536'],,,,,,,,
['1869320583831232783'],pl,False,"Tusk powiedział, że gdyby to zależało od Polski, to Ukraina by dołączyła do NATO w jeden dzień. 

Przecież to jest pomysł na wciągnięcie Polski do wojny w jeden dzień!

Musielibyśmy wysłać na Ukrainę od razu żołnierzy, inaczej sami zakwestionowalibyśmy ważność art. 5 NATO!… https://t.co/msK92syR9p",2024-12-18T09:55:32.000Z,everyone,3242182113,1869320583831232783,1869320583831232783,Original,5,True,2024-12-18 10:55:32+00:00,"[{'start': 275, 'end': 298, 'url': 'https://t.co/msK92syR9p', 'expanded_url': 'https://x.com/i/web/status/1869320583831232783', 'display_url': 'x.com/i/web/status/1…'}]",430,543,6695,18,69,283901,,"[{'domain': {'id': '88', 'name': 'Political Body', 'description': 'A section of a government, like The Supreme Court'}, 'entity': {'id': '1016738021939351558', 'name': 'North Atlantic Treaty Organization', 'description': 'North Atlantic Treaty Organization'}}, {'domain': {'id': '131', 'name': 'Unified Twitter Taxonomy', 'description': 'A taxonomy of user interests. '}, 'entity': {'id': '847878884917886977', 'name': 'Politics', 'description': 'Politics'}}, {'domain': {'id': '131', 'name': 'Unified Twitter Taxonomy', 'description': 'A taxonomy of user interests. '}, 'entity': {'id': '1016738021939351558', 'name': 'North Atlantic Treaty Organization', 'description': 'North Atlantic Treaty Organization'}}, {'domain': {'id': '131', 'name': 'Unified Twitter Taxonomy', 'description': 'A taxonomy of user interests. '}, 'entity': {'id': '1068583660914266113', 'name': 'Government institutions', 'description': 'Political Body'}}]",,,,,,,
['1868799214173798820'],pl,False,"Jednak zagęszczę jeszcze trochę ruchy. Na dniach aktualizacja, dodamy trochę miejscowości w styczniu :) https://t.co/CVBr59is7d",2024-12-16T23:23:47.000Z,everyone,3242182113,1868799214173798820,1868799214173798820,Quote,5,True,2024-12-17 00:23:47+00:00,"[{'start': 104, 'end': 127, 'url': 'https://t.co/CVBr59is7d', 'expanded_url': 'https://twitter.com/SlawomirMentzen/status/1868710158807056621', 'display_url': 'x.com/SlawomirMentze…'}]",28,81,934,7,9,75462,,,"[{'type': 'quoted', 'id': '1868710158807056621'}]",,,,,,
['1868710158807056621'],pl,False,Zapraszam na spotkania w styczniu! https://t.co/nt68ksSWVc,2024-12-16T17:29:55.000Z,everyone,3242182113,1868710158807056621,1868710158807056621,Original,5,True,2024-12-16 18:29:55+00:00,"[{'start': 35, 'end': 58, 'url': 'https://t.co/nt68ksSWVc', 'expanded_url': 'https://x.com/SlawomirMentzen/status/1868710158807056621/photo/1', 'display_url': 'pic.x.com/nt68ksSWVc', 'media_key': '3_1868710153157005313'}]",100,217,1457,25,41,328206,['3_1868710153157005313'],,,,,,,,
['1868227352825565266'],pl,False,Bardzo dziękuję mieszkańcom Legionowa za świetne spotkanie! https://t.co/oxZuoASPmw,2024-12-15T09:31:25.000Z,everyone,3242182113,1868227352825565266,1868227352825565266,Original,5,True,2024-12-15 10:31:25+00:00,"[{'start': 60, 'end': 83, 'url': 'https://t.co/oxZuoASPmw', 'expanded_url': 'https://x.com/SlawomirMentzen/status/1868227352825565266/photo/1', 'display_url': 'pic.x.com/oxZuoASPmw', 'media_key': '3_1868227346777387008'}, {'start': 60, 'end': 83, 'url': 'https://t.co/oxZuoASPmw', 'expanded_url': 'https://x.com/SlawomirMentzen/status/1868227352825565266/photo/1', 'display_url': 'pic.x.com/oxZuoASPmw', 'media_key': '3_1868227346773274624'}, {'start': 60, 'end': 83, 'url': 'https://t.co/oxZuoASPmw', 'expanded_url': 'https://x.com/SlawomirMentzen/status/1868227352825565266/photo/1', 'display_url': 'pic.x.com/oxZuoASPmw', 'media_key': '3_1868227346764902401'}, {'start': 60, 'end': 83, 'url': 'https://t.co/oxZuoASPmw', 'expanded_url': 'https://x.com/SlawomirMentzen/status/1868227352825565266/photo/1', 'display_url': 'pic.x.com/oxZuoASPmw', 'media_key': '3_1868227346773196800'}]",43,24,775,0,3,37295,"['3_1868227346777387008', '3_1868227346773274624', '3_1868227346764902401', '3_1868227346773196800']",,,,,,,,
['1868020387088601415'],pl,False,"Niesamowite, że tylu Was przychodzi na spotkania mimo niesprzyjającej pogody, mimo mrozu i późnej godziny! Bardzo dziękuję mieszkańcom Wołomina! https://t.co/JiItGdB4Rs",2024-12-14T19:49:01.000Z,everyone,3242182113,1868020387088601415,1868020387088601415,Original,5,True,2024-12-14 20:49:01+00:00,"[{'start': 145, 'end': 168, 'url': 'https://t.co/JiItGdB4Rs', 'expanded_url': 'https://x.com/SlawomirMentzen/status/1868020387088601415/photo/1', 'display_url': 'pic.x.com/JiItGdB4Rs', 'media_key': '3_1868020380654317568'}, {'start': 145, 'end': 168, 'url': 'https://t.co/JiItGdB4Rs', 'expanded_url': 'https://x.com/SlawomirMentzen/status/1868020387088601415/photo/1', 'display_url': 'pic.x.com/JiItGdB4Rs', 'media_key': '3_1868020380641705984'}, {'start': 145, 'end': 168, 'url': 'https://t.co/JiItGdB4Rs', 'expanded_url': 'https://x.com/SlawomirMentzen/status/1868020387088601415/photo/1', 'display_url': 'pic.x.com/JiItGdB4Rs', 'media_key': '3_1868020380650160128'}, {'start': 145, 'end': 168, 'url': 'https://t.co/JiItGdB4Rs', 'expanded_url': 'https://x.com/SlawomirMentzen/status/1868020387088601415/photo/1', 'display_url': 'pic.x.com/JiItGdB4Rs', 'media_key': '3_1868020380650143744'}]",55,40,1043,2,3,40752,"['3_1868020380654317568', '3_1868020380641705984', '3_1868020380650160128', '3_1868020380650143744']",,,,,,,,
['1867992019119030481'],pl,False,Bardzo cieszę się widząc jak tłumie przychodzicie na spotkania ze mną! Bardzo dziękuję mieszkańcom Mińska Mazowieckiego! https://t.co/jixqvEO1Du,2024-12-14T17:56:17.000Z,everyone,3242182113,1867992019119030481,1867992019119030481,Original,5,True,2024-12-14 18:56:17+00:00,"[{'start': 121, 'end': 144, 'url': 'https://t.co/jixqvEO1Du', 'expanded_url': 'https://x.com/SlawomirMentzen/status/1867992019119030481/photo/1', 'display_url': 'pic.x.com/jixqvEO1Du', 'media_key': '3_1867992012999331840'}, {'start': 121, 'end': 144, 'url': 'https://t.co/jixqvEO1Du', 'expanded_url': 'https://x.com/SlawomirMentzen/status/1867992019119030481/photo/1', 'display_url': 'pic.x.com/jixqvEO1Du', 'media_key': '3_1867992012995137536'}, {'start': 121, 'end': 144, 'url': 'https://t.co/jixqvEO1Du', 'expanded_url': 'https://x.com/SlawomirMentzen/status/1867992019119030481/photo/1', 'display_url': 'pic.x.com/jixqvEO1Du', 'media_key': '3_1867992012982497280'}, {'start': 121, 'end': 144, 'url': 'https://t.co/jixqvEO1Du', 'expanded_url': 'https://x.com/SlawomirMentzen/status/1867992019119030481/photo/1', 'display_url': 'pic.x.com/jixqvEO1Du', 'media_key': '3_1867992012982534146'}]",43,30,900,1,4,40913,"['3_1867992012999331840', '3_1867992012995137536', '3_1867992012982497280', '3_1867992012982534146']",,,,,,,,
['1867952959788577242'],pl,False,Bardzo dziękuję za Waszą obecność na spotkaniu w Garwolinie! https://t.co/HVLcbeugLr,2024-12-14T15:21:05.000Z,everyone,3242182113,1867952959788577242,1867952959788577242,Original,5,True,2024-12-14 16:21:05+00:00,"[{'start': 61, 'end': 84, 'url': 'https://t.co/HVLcbeugLr', 'expanded_url': 'https://x.com/SlawomirMentzen/status/1867952959788577242/photo/1', 'display_url': 'pic.x.com/HVLcbeugLr', 'media_key': '3_1867952949088894976'}, {'start': 61, 'end': 84, 'url': 'https://t.co/HVLcbeugLr', 'expanded_url': 'https://x.com/SlawomirMentzen/status/1867952959788577242/photo/1', 'display_url': 'pic.x.com/HVLcbeugLr', 'media_key': '3_1867952949101490176'}, {'start': 61, 'end': 84, 'url': 'https://t.co/HVLcbeugLr', 'expanded_url': 'https://x.com/SlawomirMentzen/status/1867952959788577242/photo/1', 'display_url': 'pic.x.com/HVLcbeugLr', 'media_key': '3_1867952949084798976'}, {'start': 61, 'end': 84, 'url': 'https://t.co/HVLcbeugLr', 'expanded_url': 'https://x.com/SlawomirMentzen/status/1867952959788577242/photo/1', 'display_url': 'pic.x.com/HVLcbeugLr', 'media_key': '3_1867952949093183488'}]",32,20,650,0,3,31176,"['3_1867952949088894976', '3_1867952949101490176', '3_1867952949084798976', '3_1867952949093183488']",,,,,,,,
['1867905348679630981'],pl,False,"Będąc w Łowiczu spotkałem się z Krzysztofem Radzikowskim i Konradem Karwatem ze Strong Ekipy. 

Myślę, że bez problemu razem zbudujemy silną Polskę :) https://t.co/luoHXqWZbt",2024-12-14T12:11:53.000Z,everyone,3242182113,1867905348679630981,1867905348679630981,Original,5,True,2024-12-14 13:11:53+00:00,"[{'start': 151, 'end': 174, 'url': 'https://t.co/luoHXqWZbt', 'expanded_url': 'https://x.com/SlawomirMentzen/status/1867905348679630981/photo/1', 'display_url': 'pic.x.com/luoHXqWZbt', 'media_key': '3_1867905343100948480'}]",116,353,6295,9,57,270771,['3_1867905343100948480'],,,,,,,,
['1867867238029570313'],pl,False,Niesamowite spotkanie w Łowiczu. Bardzo dziękuję! :) https://t.co/AwqovHh7S9,2024-12-14T09:40:27.000Z,everyone,3242182113,1867867238029570313,1867867238029570313,Original,5,True,2024-12-14 10:40:27+00:00,"[{'start': 53, 'end': 76, 'url': 'https://t.co/AwqovHh7S9', 'expanded_url': 'https://x.com/SlawomirMentzen/status/1867867238029570313/photo/1', 'display_url': 'pic.x.com/AwqovHh7S9', 'media_key': '3_1867867229351530496'}, {'start': 53, 'end': 76, 'url': 'https://t.co/AwqovHh7S9', 'expanded_url': 'https://x.com/SlawomirMentzen/status/1867867238029570313/photo/1', 'display_url': 'pic.x.com/AwqovHh7S9', 'media_key': '3_1867867229351505920'}, {'start': 53, 'end': 76, 'url': 'https://t.co/AwqovHh7S9', 'expanded_url': 'https://x.com/SlawomirMentzen/status/1867867238029570313/photo/1', 'display_url': 'pic.x.com/AwqovHh7S9', 'media_key': '3_1867867229343174656'}, {'start': 53, 'end': 76, 'url': 'https://t.co/AwqovHh7S9', 'expanded_url': 'https://x.com/SlawomirMentzen/status/1867867238029570313/photo/1', 'display_url': 'pic.x.com/AwqovHh7S9', 'media_key': '3_1867867229347328000'}]",26,26,664,0,3,34904,"['3_1867867229351530496', '3_1867867229351505920', '3_1867867229343174656', '3_1867867229347328000']",,,,,,,,
